{
  "schema_id": "lifeos_worker_result_report",
  "schema_version": 1,
  "artifact_type": "worker_report",
  "attempt": 1,
  "wrapper_id": "WAKE-ADV-20260723-051-R1",
  "run_id": "RUN-ADV-20260723-051-R1",
  "worker_id": "engineering_worker",
  "profile_version": 1,
  "owning_department": "engineering",
  "task_id": "ADV-20260723-051",
  "task_revision": 1,
  "procedure_id": "engineering_worker_hq_wake_receipt_test",
  "procedure_version": 1,
  "authorization_source": "ENGINEERING_HQ_GITHUB_RECEIPT_HQ_WAKE_TEST_20260723",
  "verification_mode": "IMMEDIATE_HQ",
  "requested_action": "Read advisory revision 1 and create one immutable receipt result pending Engineering HQ review.",
  "actual_action_attempted": "Loaded the canonical Engineering Worker boot chain and exact profile, validated the fresh advisory revision and bounded create-only reporting authority, read projects/engineering/advisories/ADV-20260723-051.md revision 1, and created this one immutable receipt report. No substantive Engineering work occurred.",
  "controlled_outcome": "IMPLEMENT",
  "completion_state": "completed",
  "evidence_references": [
    "memory/STARTUP_BOOT.md@71011fd1b4d079906d8fa8b9706457ded4d43c76",
    "coordination/LIFEOS_PROJECT_INSTRUCTIONS.md@cefbf2a57e128282c9c5e45793fc6b161d79b39f",
    "coordination/LIFEOS_HUB_OPERATING_CONTRACT.md@3dd23c41d8d22ad5960ece79d22966e0177e4681",
    "memory/00_START_HERE.md@35b96f277d371bee8e30ab2af07abcfee2bd284f",
    "memory/CONTEXT_REMINDER.md@f77014ed363066e1631eaf50b963991515c4ad08",
    "memory/03_OPERATIONAL_RULES.md@692a7109650319267939271a7adc4d10f51f6a88",
    "coordination/DEPARTMENT_FILE_OWNERSHIP_SOP.md@83ca4261bec82da4957442aff449b3ad0b0b7434",
    "coordination/OPEN_LOOP_OWNERSHIP_AND_VISIBILITY_SOP.md@09db1504a2cfef1fa9504dd636f9fab312ffb648",
    "projects/life-os-infrastructure/CHAT_WORK_EXECUTION_POLICY.md@dc9e6664f2538b16c1c507be2ca366a12ae4a218",
    "memory/06_DAILY_OPERATING_SOP.md@e30bfe331f26bf36044501f6b1e3d4f14f87e5e2",
    "coordination/LIFEOS_EXECUTION_AND_COMMUNICATION_PROTOCOL.md@ae5de028ced046a976db30889d6dde82a61ff3d1",
    "coordination/WORKER_EXECUTION_CONTRACT.md@259c5cc484f684b9a808960351f7509d14ed98f2",
    "projects/engineering/DEPARTMENT_IDENTITY.md@80be6744ec8b51323578ac2ca526b0d4a76cb197",
    "projects/engineering/workers/engineering_worker.md@c28aa503eece1c2a5473960550a3797fd642778e",
    "coordination/ADVISORY_INDEX.md@f09f379d2348c4055a0fe9c0a2d30517cc9cadf3",
    "projects/engineering/advisories/ADV-20260723-051.md@1001c72a1b6db0a7368323a1f1a09a588c01d63f",
    "projects/engineering/procedures/engineering_worker_hq_wake_receipt_test.md@3d96fcd355bc51b0a606bbe4f9842a3513ebdfc6",
    "projects/engineering/procedures/engineering_worker_result_submission.md@2faed99249ee268c7bc746104d5e1319428c6bb6",
    "apps/lifeos-dashboard/lifeos_dashboard/data/worker-result-report.schema.json@3af530522217da7ee00622156837bafdad84c842",
    "apps/lifeos-dashboard/lifeos_dashboard/data/worker-result-examples.json@3ba9452880df5b600629ed3c5e7031371b1f33df",
    "projects/engineering/worker-results/engineering_worker/RUN-ADV-20260723-051-R1/report-001.json@preflight:not-found"
  ],
  "actual_read_scopes": [
    "memory/STARTUP_BOOT.md",
    "coordination/LIFEOS_PROJECT_INSTRUCTIONS.md",
    "coordination/LIFEOS_HUB_OPERATING_CONTRACT.md",
    "memory/00_START_HERE.md",
    "memory/CONTEXT_REMINDER.md",
    "memory/03_OPERATIONAL_RULES.md",
    "coordination/DEPARTMENT_FILE_OWNERSHIP_SOP.md",
    "coordination/OPEN_LOOP_OWNERSHIP_AND_VISIBILITY_SOP.md",
    "projects/life-os-infrastructure/CHAT_WORK_EXECUTION_POLICY.md",
    "memory/06_DAILY_OPERATING_SOP.md",
    "coordination/LIFEOS_EXECUTION_AND_COMMUNICATION_PROTOCOL.md",
    "coordination/WORKER_EXECUTION_CONTRACT.md",
    "projects/engineering/DEPARTMENT_IDENTITY.md",
    "projects/engineering/workers/engineering_worker.md",
    "coordination/ADVISORY_INDEX.md",
    "projects/engineering/advisories/ADV-20260723-051.md",
    "projects/engineering/procedures/engineering_worker_hq_wake_receipt_test.md",
    "projects/engineering/procedures/engineering_worker_result_submission.md",
    "apps/lifeos-dashboard/lifeos_dashboard/data/worker-result-report.schema.json",
    "apps/lifeos-dashboard/lifeos_dashboard/data/worker-result-examples.json",
    "projects/engineering/worker-results/engineering_worker/RUN-ADV-20260723-051-R1/report-001.json"
  ],
  "actual_write_scopes": [
    "projects/engineering/worker-results/engineering_worker/RUN-ADV-20260723-051-R1/report-001.json"
  ],
  "actual_tools": [
    "GitHub"
  ],
  "what_did_not_occur": [
    "No substantive Engineering work occurred.",
    "No advisory or Advisory Index lifecycle change occurred.",
    "No file other than the authorized current-run receipt report was created or modified.",
    "No overwrite, rename, move, or deletion occurred.",
    "No work was re-executed and no scope was expanded.",
    "No code, tests, terminal, desktop automation, external-system action, HQ-review artifact, or Rob-validation artifact occurred.",
    "No Engineering HQ verification was claimed."
  ],
  "unresolved_risks": [
    "Deterministic dashboard ingestion and the required Engineering HQ wake and review remain pending.",
    "A canonical SHA-256 content checksum was not exposed by the authorized GitHub connector surface and must be calculated by the deterministic ingester from the stored JSON."
  ],
  "review_condition": "Engineering HQ must verify report identity, assignment correlation, the exact advisory-read evidence, authority compliance, the sole write scope, and the absence of substantive or additional work after deterministic dashboard ingestion.",
  "verification_state": "pending",
  "external_actions_verified": true,
  "approval_required_discovered": false,
  "failure_reason": null
}
