{
  "schema_id": "lifeos_worker_result_report",
  "schema_version": 1,
  "artifact_type": "worker_report",
  "attempt": 1,
  "wrapper_id": "WAKE-ADV-20260721-048-R1",
  "run_id": "RUN-ADV-20260721-048-R1",
  "worker_id": "engineering_worker",
  "profile_version": 1,
  "owning_department": "engineering",
  "task_id": "ADV-20260721-048",
  "task_revision": 1,
  "procedure_id": "engineering_worker_result_outbox_validation",
  "procedure_version": 1,
  "authorization_source": "ENGINEERING_HQ_PACKAGE_E_SLICE3_LIVE_OUTBOX_PILOT_20260721",
  "verification_mode": "IMMEDIATE_HQ",
  "requested_action": "Read the four exact Engineering-owned targets, answer the three bounded verification questions, and create one immutable schema-valid Worker report at the authorized current-run result path.",
  "actual_action_attempted": "Loaded the canonical Worker boot chain and exact Engineering Worker profile; validated advisory revision 1, authority, scopes, tools, verification mode, duplicate state, and existing-file state; read the four exact targets; confirmed all three bounded claims were aligned; and created this immutable current-run report artifact.",
  "controlled_outcome": "IMPLEMENT",
  "completion_state": "completed",
  "evidence_references": [
    "memory/STARTUP_BOOT.md@71011fd1b4d079906d8fa8b9706457ded4d43c76",
    "coordination/LIFEOS_PROJECT_INSTRUCTIONS.md@cefbf2a57e128282c9c5e45793fc6b161d79b39f",
    "coordination/LIFEOS_HUB_OPERATING_CONTRACT.md@3dd23c41d8d22ad5960ece79d22966e0177e4681",
    "memory/00_START_HERE.md@35b96f277d371bee8e30ab2af07abcfee2bd284f",
    "memory/CONTEXT_REMINDER.md@f77014ed363066e1631eaf50b963991515c4ad08",
    "memory/03_OPERATIONAL_RULES.md@692a7109650319267939271a7adc4d10f51f6a88",
    "coordination/DEPARTMENT_FILE_OWNERSHIP_SOP.md@83ca4261bec82da4957442aff449b3ad0b0b7434",
    "coordination/OPEN_LOOP_OWNERSHIP_AND_VISIBILITY_SOP.md@09db1504a2cfef1fa9504dd636f9fab312ffb648",
    "projects/life-os-infrastructure/CHAT_WORK_EXECUTION_POLICY.md@dc9e6664f2538b16c1c507be2ca366a12ae4a218",
    "memory/06_DAILY_OPERATING_SOP.md@e30bfe331f26bf36044501f6b1e3d4f14f87e5e2",
    "coordination/LIFEOS_EXECUTION_AND_COMMUNICATION_PROTOCOL.md@ae5de028ced046a976db30889d6dde82a61ff3d1",
    "coordination/WORKER_EXECUTION_CONTRACT.md@259c5cc484f684b9a808960351f7509d14ed98f2",
    "projects/engineering/DEPARTMENT_IDENTITY.md@80be6744ec8b51323578ac2ca526b0d4a76cb197",
    "projects/engineering/workers/engineering_worker.md@c28aa503eece1c2a5473960550a3797fd642778e",
    "coordination/boards/engineering.md@30d42243d8b1f48d84cc9dbaa2b494f398bb63e9",
    "projects/engineering/procedures/engineering_worker_result_outbox_validation.md@08cacdca9c9afc280b034757faa02f0131ed7951",
    "projects/engineering/procedures/engineering_worker_result_submission.md@2faed99249ee268c7bc746104d5e1319428c6bb6",
    "projects/engineering/PACKAGE_E_IMPLEMENTATION_PACKET.md@4fe17028a3a17091e354a768b178f80b7225cd48",
    "apps/lifeos-dashboard/lifeos_dashboard/data/worker-result-report.schema.json@3af530522217da7ee00622156837bafdad84c842",
    "apps/lifeos-dashboard/lifeos_dashboard/data/worker-result-examples.json@b384f17e162bfd4e7ed5ff332997a91653df10f4",
    "projects/engineering/worker-results/engineering_worker/RUN-ADV-20260721-048-R1/report-001.json@preflight:not-found"
  ],
  "actual_read_scopes": [
    "memory/STARTUP_BOOT.md",
    "coordination/LIFEOS_PROJECT_INSTRUCTIONS.md",
    "coordination/LIFEOS_HUB_OPERATING_CONTRACT.md",
    "memory/00_START_HERE.md",
    "memory/CONTEXT_REMINDER.md",
    "memory/03_OPERATIONAL_RULES.md",
    "coordination/DEPARTMENT_FILE_OWNERSHIP_SOP.md",
    "coordination/OPEN_LOOP_OWNERSHIP_AND_VISIBILITY_SOP.md",
    "projects/life-os-infrastructure/CHAT_WORK_EXECUTION_POLICY.md",
    "memory/06_DAILY_OPERATING_SOP.md",
    "coordination/LIFEOS_EXECUTION_AND_COMMUNICATION_PROTOCOL.md",
    "coordination/WORKER_EXECUTION_CONTRACT.md",
    "projects/engineering/DEPARTMENT_IDENTITY.md",
    "projects/engineering/workers/engineering_worker.md",
    "coordination/boards/engineering.md",
    "projects/engineering/procedures/engineering_worker_result_outbox_validation.md",
    "projects/engineering/procedures/engineering_worker_result_submission.md",
    "projects/engineering/PACKAGE_E_IMPLEMENTATION_PACKET.md",
    "apps/lifeos-dashboard/lifeos_dashboard/data/worker-result-report.schema.json",
    "apps/lifeos-dashboard/lifeos_dashboard/data/worker-result-examples.json",
    "projects/engineering/worker-results/engineering_worker/RUN-ADV-20260721-048-R1/report-001.json"
  ],
  "actual_write_scopes": [
    "projects/engineering/worker-results/engineering_worker/RUN-ADV-20260721-048-R1/report-001.json"
  ],
  "actual_tools": [
    "GitHub"
  ],
  "what_did_not_occur": [
    "No advisory lifecycle change occurred.",
    "No file other than the authorized current-run result artifact was created or modified.",
    "No overwrite, rename, move, or deletion occurred.",
    "No work was re-executed and no scope was expanded.",
    "No code, tests, terminal, desktop automation, connector action outside GitHub, or external-system action occurred."
  ],
  "unresolved_risks": [
    "Deterministic result ingestion and Engineering HQ review remain pending; this report is immutable evidence and not an HQ-signed result."
  ],
  "review_condition": "Engineering HQ must validate report integrity, assignment correlation, authority compliance, source evidence, and the inspected claims after deterministic ingestion becomes available.",
  "verification_state": "pending",
  "external_actions_verified": true,
  "approval_required_discovered": false,
  "failure_reason": null
}
