{
  "schema_id": "lifeos_worker_result_report",
  "schema_version": 1,
  "artifact_type": "worker_report",
  "attempt": 2,
  "wrapper_id": "WAKE-ADV-20260726-053-R1",
  "run_id": "RUN-ADV-20260726-053-R1",
  "worker_id": "maintenance_worker",
  "profile_version": 1,
  "owning_department": "maintenance",
  "task_id": "ADV-20260726-053",
  "task_revision": 1,
  "procedure_id": "maintenance_coordinated_repository_repair",
  "procedure_version": 1,
  "authorization_source": "ROB",
  "verification_mode": "IMMEDIATE_HQ",
  "requested_action": "Perform one Rob-approved repository-wide coherence audit, repair clearly stale current canonical operational records inside the authorized repair roots, submit one immutable result, and leave source lifecycle unchanged for Maintenance_HQ review.",
  "actual_action_attempted": "Read the rejected attempt-1 report and deterministic rejection artifact; preserved the original audit findings, repair evidence, controlled outcome, and hold destinations; corrected only report correlation by setting attempt 2, limiting actual read and write scopes to the derived correction-only contract, using only the approved GitHub tool, and normalizing evidence witnesses; then prepared this immutable corrected report without re-executing or broadening the underlying work.",
  "controlled_outcome": "REPORT_AND_HOLD",
  "completion_state": "partial",
  "evidence_references": [
    "projects/life-logistics-hq/worker-results/maintenance_worker/RUN-ADV-20260726-053-R1/report-001.json@blob:555be4707e467844b0c1cfbc13a22d4826eebf79",
    "projects/life-logistics-hq/worker-results/maintenance_worker/RUN-ADV-20260726-053-R1/rejection-001.json@blob:a594bac6b9d74bece5970d354cde6d2d1340f901",
    "projects/life-logistics-hq/worker-results/maintenance_worker/RUN-ADV-20260726-053-R1/report-002.json@preflight:not-found",
    "coordination/boards/engineering.md@blob:2139d0e9d42a54ea3c6d4c2e6a4edc80c96599c9",
    "coordination/ADVISORY_INDEX.md@blob:460600b575f217c3f532ae100903e8d25452c8c8",
    "projects/life-logistics-hq/workers/maintenance_worker.md@blob:200840e28d8b4397d80f0108cb1f5e3064a40ba3",
    "projects/life-logistics-hq/procedures/maintenance_coordinated_repository_repair.md@blob:50e0a09364a063db2ded464ae9315ba479310b66",
    "projects/life-logistics-hq/procedures/maintenance_worker_result_submission.md@blob:56cddd40b3a825511a0a30f2ad3d1b10ece655b6",
    "memory/HQ_NAMING_STANDARD.md@commit:9d105070713c97e3137d357171e904b7ff021123@blob:f1d49250687ac87faded38ada4ce179bb42e551f",
    "projects/engineering/open_loops.md@commit:b414854441fbfb198c4dff910be8c92da0d2fa00@blob:f6b7d837f138965a26df73d723635e90b7832d72",
    "projects/life-logistics-hq/status.md@commit:23a95213c79738618c052eeeabc9bccb8047fa54@blob:4056609d982c8411c11135c58068bc53ea1be044",
    "projects/life-logistics-hq/open_loops.md@commit:f3e6a5f36729c4c4dc40cc994624e93870f3f113@blob:e9f91dc8614f0a09814af2dd16b076f0e2651732",
    "projects/engineering/status.md@commit:b17bcf7e3bff47b2f62210b1774fe32b3ae45a41@blob:4680353b5a185eee048f4c071a82bcbab7439730",
    "projects/life-logistics-hq/README.md@commit:bf763b257cac90063c47466c2806c7c86fbd7dfa@blob:7dce07c141c795493771c7a4662f90fba2b56e01",
    "projects/engineering/README.md@commit:0cf409d35c96809b512297d615ca27edb3fd3f6c@blob:4919844b02aca5727dc322aeef7187f39db88edb",
    "memory/04_ACTIVE_PROJECTS.md@commit:0ee5e88e3c604d9df155431ac962a783cae78aa2@blob:2dca537c15715c66f6ffc6b7be7ca7b495b8b6f7",
    "projects/main-assistant/status.md@commit:620899d12305a054bd605485efa1756c4ce5988b@blob:d101278ffe493dd6e247763ec62ff4cc2962ca7c",
    "memory/01_SESSION_HANDOFF.md@commit:55c0aa8812a22560906fab576c35bacaf56a65e9@blob:63c12e80ccad3fc711fe34812cb10557fd056154",
    "projects/main-assistant/open_loops.md@commit:b003bffc2cdf9d231ca899975b059e06e0721115@blob:2d4bdd351874b357d003650d022774df5a3ced69"
  ],
  "actual_read_scopes": [
    "projects/life-logistics-hq/worker-results/maintenance_worker/RUN-ADV-20260726-053-R1/report-001.json",
    "projects/life-logistics-hq/worker-results/maintenance_worker/RUN-ADV-20260726-053-R1/rejection-001.json",
    "projects/life-logistics-hq/worker-results/maintenance_worker/RUN-ADV-20260726-053-R1/report-002.json"
  ],
  "actual_write_scopes": [
    "projects/life-logistics-hq/worker-results/maintenance_worker/RUN-ADV-20260726-053-R1/report-002.json"
  ],
  "actual_tools": [
    "GitHub"
  ],
  "what_did_not_occur": [
    "The underlying repository audit and repair work was not re-executed, repeated, or broadened during report repair.",
    "No application code, tests, schemas, selectors, automation implementation, or runtime database was modified.",
    "No Worker profile or procedure was modified.",
    "The source advisory and Advisory Index were not modified.",
    "Attempt 1 and rejection 1 were not overwritten, edited, deleted, renamed, or moved.",
    "No archive, historical notebook, immutable Worker result other than the new authorized attempt, HQ review, Rob validation, or Git history was rewritten.",
    "No file was deleted, renamed, moved, or archived.",
    "No Drive, Trello, Todoist, Calendar, Gmail, Slack, financial, public, destructive, spending, schedule, connector, or other external-system action occurred.",
    "No advisory or source-owner open loop was closed.",
    "No scope expansion, permanent cross-department authority, or unattended authority was created."
  ],
  "unresolved_risks": [
    "HOLD — coordination/WORKER_EXECUTION_CONTRACT.md still presents Engineering_Worker as the sole current Worker title and Maintenance_Worker as a future example. Owner and destination: Maintenance_HQ, coordination/WORKER_EXECUTION_CONTRACT.md. A focused localized owner edit is required because the available GitHub write operation replaces the entire 470-line contract and safe preservation of unrelated contractual text could not be guaranteed in the original run.",
    "HOLD — projects/life-logistics-hq/SESSION_HANDOFF.md retains the pre-assignment Maintenance Worker state. Owner and destination: Maintenance_HQ, projects/life-logistics-hq/SESSION_HANDOFF.md. Current status, README, open-loop ledger, global handoff, and active-project map were repaired; the large local handoff requires a focused owner edit to avoid incidental continuity loss.",
    "HOLD — projects/engineering/SESSION_HANDOFF.md retains pre-assignment and pending-exact-assignment language. Owner and destination: Engineering_HQ, projects/engineering/SESSION_HANDOFF.md. Engineering status, README, and open-loop ledger were repaired; the large local handoff requires a focused owner edit.",
    "HOLD — projects/main-assistant/SESSION_HANDOFF.md retains pre-rollout cross-department routing and older advisory or Office Leaks context. Owner and destination: Chief_of_Staff_HQ, projects/main-assistant/SESSION_HANDOFF.md. Chief of Staff status and open-loop ledger were repaired; the large local handoff requires a focused owner edit.",
    "Maintenance_HQ review, deterministic ingestion, and any source-owner lifecycle update remain pending; the source advisory is intentionally still OPEN."
  ],
  "review_condition": "Maintenance_HQ must verify corrected report integrity and correlation, advisory and profile compliance, the eleven original committed repairs and read-back evidence, the four explicit holds and owner destinations, and whether a separately bounded localized handoff and Worker-contract repair should resume before the source owner changes or closes ADV-20260726-053.",
  "verification_state": "pending",
  "external_actions_verified": true,
  "approval_required_discovered": false,
  "failure_reason": "Partial hold preserved from attempt 1: four broad current canonical records remain intentionally untouched because the available GitHub contents operation requires whole-file replacement and a safe localized edit preserving all unrelated text could not be guaranteed within the original run."
}
